Category,Role,Description
"X. MAGICAL ARTS, the",Druid ,"a mage attuned to the magical forces of nature, able to shapeshift, call on the elements, communicate with flora and fauna, etc."
"X. MAGICAL ARTS, the",Elementalist ,manipulates nature’s elements to their will.
"X. MAGICAL ARTS, the",Enchanter/Enchantress ,uses sorcery to put someone or something under a spell.
"X. MAGICAL ARTS, the",Evoker ,manipulates energy or taps into an unseen source of power in order to produce a desired kinetic end.
"X. MAGICAL ARTS, the",Healer ,able to cure a disease or injury using magic.
"X. MAGICAL ARTS, the",Hearth Witch/Hearth Wizard ,incorporates spells and enchantments in cooking.
"X. MAGICAL ARTS, the",Illusionist ,performs tricks and spells that deceive the senses.
"X. MAGICAL ARTS, the",Mage ,a magic-user.
"X. MAGICAL ARTS, the",Medium ,"uses extrasensory perception, magic, or divine powers to identify information hidden from the normal senses."
"X. MAGICAL ARTS, the",Meteorologist ,forecasts and manipulates weather.
"X. MAGICAL ARTS, the",Necromancer ,communicates with and conjures the spirits of the dead.
"X. MAGICAL ARTS, the",Ritualist ,practices or advocates the observance of ritual (formula intended to trigger a magical effect on a person or objects).
"X. MAGICAL ARTS, the",Runecaster ,uses special alphabets to create runes (symbols possessing magical effects capable of being used multiple times).
"X. MAGICAL ARTS, the",Sage ,a wise and experienced magic-user.
"X. MAGICAL ARTS, the",Seer/Oracle ,able to see what the future holds through supernatural insight.
"X. MAGICAL ARTS, the",Shaman ,accesses and influences the world of good and evil spirits.
"X. MAGICAL ARTS, the",Shapeshifter ,a person with the ability to change their physical form.
"X. MAGICAL ARTS, the",Sorcerer/Sorceress ,derives their magical abilities innately rather than through study.
"X. MAGICAL ARTS, the",Summoner ,"a mage able to summon forth magical beasts, creatures, and monsters."
"X. MAGICAL ARTS, the",Transmuter ,"alters matter in form, appearance, or nature."
"X. MAGICAL ARTS, the",Warlock ,a mage who has gained their abilities by forming a pact with an otherworldly being.
"X. MAGICAL ARTS, the",Witchdoctor ,"a tribal mage with powers of healing, divination, and protection against the magic of others."
"X. MAGICAL ARTS, the",Witch ,"a woman who has supernatural powers and practices sorcery, typically in solitude."
"X. MAGICAL ARTS, the",Wizard ,derives their magical abilities through study.
"X. MAGICAL ARTS, the",Wordsmith ,draws their power from language and casts by dictation.
XI. MILITARY & SECURITY,Admiral ,commands a fleet or naval squadron.
XI. MILITARY & SECURITY,Bailiff ,looks after prisoners.
XI. MILITARY & SECURITY,Bodyguard ,"escorts and protects another person, especially a dignitary."
XI. MILITARY & SECURITY,Bouncer ,prevents troublemakers from entering or to eject them from the premises of an establishment.
XI. MILITARY & SECURITY,Captain ,an army officer of high rank in charge of commanding squadrons of soldiers.
XI. MILITARY & SECURITY,Castellan ,the governor of a castle.
XI. MILITARY & SECURITY,Cavalryman/Cavalier ,a skilled horseback rider.
XI. MILITARY & SECURITY,City Watch ,an officer of law enforcement who resides in larger towns or cities.
XI. MILITARY & SECURITY,Commissar ,teaches principles and policies to military units.
XI. MILITARY & SECURITY,Constable ,"an officer with limited policing authority, typically in a small town."
XI. MILITARY & SECURITY,Detective/Investigator ,investigates and solves crimes.
XI. MILITARY & SECURITY,Drummer/Fifer ,a non-combatant foot soldier who sounds signals for changes in formation in combat.
XI. MILITARY & SECURITY,Duelist ,skilled in one-on-one combat.
XI. MILITARY & SECURITY,Executioner ,carries out a sentence of death on a legally condemned person.
XI. MILITARY & SECURITY,Firefighter ,extinguishes fires.
XI. MILITARY & SECURITY,Guard/Sentinel ,"a person who keeps watch, especially a soldier or other person formally assigned to protect a person or to control access to a place."
XI. MILITARY & SECURITY,General ,the chief commander of an army.
XI. MILITARY & SECURITY,Inspection Officer ,responsible for the inspection of military units to ensure they meet appropriate standards of training and efficiency.
XI. MILITARY & SECURITY,Intelligence Officer ,"collects, compiles and organizes information about the enemy."
XI. MILITARY & SECURITY,Jailer ,supervises a jail and the prisoners in it.
XI. MILITARY & SECURITY,Lieutenant ,an officer of middle rank in the armed forces.
XI. MILITARY & SECURITY,Marksman/Archer ,"in long-range weapons, such as the bow, crossbow, sling, etc. to inflict damage from afar."
XI. MILITARY & SECURITY,Marshall ,has the charge of the cavalry in the household of a monarch.
XI. MILITARY & SECURITY,Medic ,a medical practitioner equipped for the battlefield.
XI. MILITARY & SECURITY,Mercenary ,"a soldier without allegiance who works for money, typically a member of a company or guild."
XI. MILITARY & SECURITY,Privateer ,engages in maritime warfare under a commission of war.
XI. MILITARY & SECURITY,Quartermaster ,"responsible for providing quarters, rations, clothing, and other supplies."
XI. MILITARY & SECURITY,Royal Guard ,responsible for the protection of a royal person.
XI. MILITARY & SECURITY,Runner ,carries information between lines in wartime.
XI. MILITARY & SECURITY,Sapper ,"a soldier responsible for tasks such as building and repairing roads and bridges, laying and clearing mines, etc."
XI. MILITARY & SECURITY,Sergeant ,"an officer instructed with a protective duty, typically worth “half a knight” in regard."
XI. MILITARY & SECURITY,Sergeant-at-Arms ,"charged with keeping order during meetings and, if necessary, participates in battle."
XI. MILITARY & SECURITY,Scout ,"sent ahead of a main force so as to gather information about the enemy’s position, strength, or movements."
XI. MILITARY & SECURITY,Siege Artillerist ,works the artillery machines of an army.
XI. MILITARY & SECURITY,Slave Driver ,oversees and urges on slaves at work.
XI. MILITARY & SECURITY,Soldier/Man-at-Arms ,serves in an army.
XI. MILITARY & SECURITY,Special Force Soldier ,carries out special operations.
XI. MILITARY & SECURITY,Spy ,"secretly collects and reports information on the activities, movements, and plans of an enemy or competitor."
XI. MILITARY & SECURITY,Tactician ,uses a carefully planned military strategy to achieve a specific end.
XI. MILITARY & SECURITY,Tollkeeper ,"collects tolls at a bridge, road etc. where a charge is made."
XI. MILITARY & SECURITY,Torturer ,inflicts severe pain on someone as a punishment or in order to force them to do or say something.
XI. MILITARY & SECURITY,Warden ,responsible for the supervision of a particular place or thing or for ensuring that regulations associated with it are obeyed.
XI. MILITARY & SECURITY,Warmage ,a soldier skilled in destructive battle magic.
XII. RELIGION,Abbot/Abbess ,the head of an abbey of monks.
XII. RELIGION,Acolyte ,assists the celebrant in a religious service or procession.
XII. RELIGION,Almoner ,distributes money and food to poor people.
XII. RELIGION,Archbishop ,"responsible for an archdiocese, their surrounding district."
XII. RELIGION,Bishop ,"a senior member of the clergy, usually in charge of a diocese and empowered to confer holy orders."
XII. RELIGION,Cantor ,sings liturgical music and leads prayer in a synagogue.
XII. RELIGION,Cardinal ,"a leading dignitary of a church, nominated by the highest official."
XII. RELIGION,Chaplain ,"a member of the clergy attached to a private chapel, institution, ship, branch of the armed forces, etc."
XII. RELIGION,Cleric ,"has devoted their entire being to the will of their god, thus gaining magical powers."
XII. RELIGION,Confessor ,hears confessions and gives absolution and spiritual counsel.
XII. RELIGION,Cultist ,a member of a cult who generally lives outside of conventional society and worships an unorthodox patron.
XII. RELIGION,Cult Leader ,the organizational leader of a cult who is occasionally also the founder.
XII. RELIGION,Deacon ,an ordained minister of an order ranking below that of priest.
XII. RELIGION,Diviner ,seeks ultimate divination in order to further understand or meet godly substance.
XII. RELIGION,Exorcist ,expels or attempts to expel evil spirits from a person or place.
XII. RELIGION,High Priest/Pope ,the chief priest of a religion.
XII. RELIGION,Inquisitor ,seeks to eliminate heresy and other things contrary to the doctrine or teachings of their faith.
XII. RELIGION,Missionary ,goes on a religious mission to promote their faith in a foreign place.
XII. RELIGION,Monk ,"able to manifest their spirituality through a calm, centered being and thus gain abilities which function similarly to magic."
XII. RELIGION,Nun ,"a member of a religious community of women, especially a cloistered one, living under vows of poverty, chastity, and obedience."
XII. RELIGION,Paladin ,a holy knight and divine spellcaster crusading in the name of good and order.
XII. RELIGION,Pardoner ,raises money for religious works by soliciting offerings and granting indulgences.
XII. RELIGION,Priest ,has the authority to perform certain rites and administer certain sacraments.
XII. RELIGION,Prophet ,regarded as an inspired teacher or proclaimer of the will of God.
XII. RELIGION,Sexton ,"looks after a church and churchyard, sometimes acting as bell-ringer and formerly as a gravedigger."
XII. RELIGION,Templar ,fights in a religious military order.
"XIII. SCIENCE, MATH, & EDUCATION",Abecedarian ,teaches the illiterate.
"XIII. SCIENCE, MATH, & EDUCATION",Accoucheur/Obstetrician/Midwife ,assists in childbirth and the care of women giving birth.
"XIII. SCIENCE, MATH, & EDUCATION",Anthropologist ,"studies the customs, beliefs, and relationships of humanoids and intellectually and culturally advanced creatures."
"XIII. SCIENCE, MATH, & EDUCATION",Apothecary ,"prepares and sells medicines, drugs, and potions."
"XIII. SCIENCE, MATH, & EDUCATION",Apprentice ,studies a trade under a skilled employer.
"XIII. SCIENCE, MATH, & EDUCATION",Archaeologist ,studies humanoid history and prehistory through the excavation of sites and the analysis of artifacts and other physical remains.
"XIII. SCIENCE, MATH, & EDUCATION",Archivist ,maintains and is in charge of archives.
"XIII. SCIENCE, MATH, & EDUCATION",Assayer ,"determiner of the proportions of metal in ore and the amount of copper, silver, gold, or platinum in coins."
"XIII. SCIENCE, MATH, & EDUCATION",Astrologer ,uses astrology to tell others about their character or to predict their future.
"XIII. SCIENCE, MATH, & EDUCATION",Astronomer ,makes observations of celestial and scientific phenomena within the material plane.
"XIII. SCIENCE, MATH, & EDUCATION",Bloodletter ,surgically removes some of a patient’s blood for therapeutic purposes.
"XIII. SCIENCE, MATH, & EDUCATION",Botanist ,an expert in or student of the scientific study of plants.
"XIII. SCIENCE, MATH, & EDUCATION",Cartographer ,a scholar and illustrator of maps.
"XIII. SCIENCE, MATH, & EDUCATION",Chemist ,engaged in chemical research or experiments.
"XIII. SCIENCE, MATH, & EDUCATION",Dean ,the head of a college or university.
"XIII. SCIENCE, MATH, & EDUCATION",Doctor/Physician ,a qualified practitioner of medicine.
"XIII. SCIENCE, MATH, & EDUCATION",Drakologist ,studies or is an expert in the branch of zoology concerned with dragons.
"XIII. SCIENCE, MATH, & EDUCATION",Engineer ,designer of a machine or structure.
"XIII. SCIENCE, MATH, & EDUCATION",Entomologist ,studies or is an expert in the branch of zoology concerned with insects.
"XIII. SCIENCE, MATH, & EDUCATION",Herbalist ,practices healing by the use of herbs.
"XIII. SCIENCE, MATH, & EDUCATION",Historian ,"an expert in or student of history, especially that of a particular period, geographical region, or social phenomenon."
"XIII. SCIENCE, MATH, & EDUCATION",Horologist ,a scholar of time and entropy.
"XIII. SCIENCE, MATH, & EDUCATION",Librarian ,administers or assists in a library.
"XIII. SCIENCE, MATH, & EDUCATION",Mathematician ,"a scholar of the abstract science of number, quantity, and space."
"XIII. SCIENCE, MATH, & EDUCATION",Mortician ,prepares dead bodies for burial or cremation and makes arrangements for funerals.
"XIII. SCIENCE, MATH, & EDUCATION",Nurse ,"cares for the sick or infirm, especially in a hospital."
"XIII. SCIENCE, MATH, & EDUCATION",Optometrist ,examines the eyes for visual defects and prescribes eyeglasses.
"XIII. SCIENCE, MATH, & EDUCATION",Philosopher ,"a scholar of the fundamental nature of knowledge, reality, and existence."
"XIII. SCIENCE, MATH, & EDUCATION",Professor ,a teacher of the highest rank in a college or university.
"XIII. SCIENCE, MATH, & EDUCATION",Scholar/Researcher ,a specialist in a particular branch of study who pursues the acquisition of knowledge.
"XIII. SCIENCE, MATH, & EDUCATION",Scribe ,copies out manuscripts.
"XIII. SCIENCE, MATH, & EDUCATION",Student ,attends school or learns under other to enter and pursue a particular subject.
"XIII. SCIENCE, MATH, & EDUCATION",Surgeon/Chirurgeon ,practices surgery.
"XIII. SCIENCE, MATH, & EDUCATION",Taxonomist ,groups organisms into categories.
"XIII. SCIENCE, MATH, & EDUCATION",Teacher ,instructs on a particular skill or subject.
"XIII. SCIENCE, MATH, & EDUCATION",Theologian ,engages in the study of the nature of God and religious belief.
"XIII. SCIENCE, MATH, & EDUCATION",Tutor ,charged with the instruction and guidance of another.
"XIII. SCIENCE, MATH, & EDUCATION",Veterinarian ,treats diseased or injured animals.
"XIII. SCIENCE, MATH, & EDUCATION",Zoologist ,"an expert in or a student of the behavior, physiology, classification, and distribution of animals."
XIV. TRANSPORTATION,Boatman ,mans a small seacraft.
XIV. TRANSPORTATION,Bosun ,in charge of organizing the equipment and crew of a ship.
XIV. TRANSPORTATION,Cabbie/Wagoner ,drives a horse-drawn wagon.
XIV. TRANSPORTATION,Cabin Boy/Cabin Girl ,waits on the orders of a ship’s officers and passengers.
XIV. TRANSPORTATION,Caravaneer ,travels or lives in a caravan.
XIV. TRANSPORTATION,Charioteer ,drives a chariot.
XIV. TRANSPORTATION,Carter ,transports goods by cart.
XIV. TRANSPORTATION,Ferryman ,operates a ferry.
XIV. TRANSPORTATION,First Mate ,the deck officer second in command to the master of a ship.
XIV. TRANSPORTATION,Helmsman ,steers a ship or boat.
XIV. TRANSPORTATION,Navigator ,"directs the route or course of a ship or other form of transportation, especially by using instruments and maps."
XIV. TRANSPORTATION,Purser ,"keeps the accounts of a ship, especially as the head steward on a passenger vessel."
XIV. TRANSPORTATION,Sailor ,works as a member of the crew of a commercial or naval ship or boat.
XIV. TRANSPORTATION,Sea Captain ,commands a ship.
XIV. TRANSPORTATION,Shipwright ,a carpenter skilled in ship construction and repair.
"XV. UNEMPLOYED, SELF-EMPLOYED, & OUTCAST",Adventurer ,"wanders the world in search of knowledge, treasure, fame, glory or a multitude of additional wants and desires."
"XV. UNEMPLOYED, SELF-EMPLOYED, & OUTCAST",Beggar/Pauper ,lives by asking for money or food.
"XV. UNEMPLOYED, SELF-EMPLOYED, & OUTCAST",Blood Hunter/Monster Hunter ,takes on jobs to hunt down and kill or capture dangerous creatures.
"XV. UNEMPLOYED, SELF-EMPLOYED, & OUTCAST",Bounty Hunter ,pursues a criminal or fugitive for whom a reward is offered.
"XV. UNEMPLOYED, SELF-EMPLOYED, & OUTCAST",Crossing Sweeper ,sweeps a path ahead of people crossing dirty urban streets in exchange for a gratuity.
"XV. UNEMPLOYED, SELF-EMPLOYED, & OUTCAST",Deserter ,a member of the armed forces who has deserted.
"XV. UNEMPLOYED, SELF-EMPLOYED, & OUTCAST",Disgraced Noble ,"a person of high birth who has since loss their respect, honor, or esteem in some or all noble circles."
"XV. UNEMPLOYED, SELF-EMPLOYED, & OUTCAST",Drunkard ,a person who is habitually drunk and considers themselves a professional in the task.
"XV. UNEMPLOYED, SELF-EMPLOYED, & OUTCAST",Dungeon Delver ,navigates underground labyrinths in search of any treasure they may find.
"XV. UNEMPLOYED, SELF-EMPLOYED, & OUTCAST",Elder ,"a person of a greater age, especially one with a respected position in society."
"XV. UNEMPLOYED, SELF-EMPLOYED, & OUTCAST",Exile ,"lives away from their native country, either from choice or compulsion."
"XV. UNEMPLOYED, SELF-EMPLOYED, & OUTCAST",Explorer ,explores unfamiliar areas in search of geographical or scientific information.
"XV. UNEMPLOYED, SELF-EMPLOYED, & OUTCAST",Ex-Criminal ,"a person who has been convicted of a crime and has since served their sentence, or who has preemptively given up their life of crime."
"XV. UNEMPLOYED, SELF-EMPLOYED, & OUTCAST",Folk Hero ,a celebrity who is greatly admired by many people of a particular kind or in a particular place.
"XV. UNEMPLOYED, SELF-EMPLOYED, & OUTCAST",Gambler ,"bets money on sports, card games, or games of chance in the hope of a profit."
"XV. UNEMPLOYED, SELF-EMPLOYED, & OUTCAST",Grave Robber/Tomb Raider ,steals valuables from graves and tombs.
"XV. UNEMPLOYED, SELF-EMPLOYED, & OUTCAST",Heretic ,differs in opinion from established religious dogma.
"XV. UNEMPLOYED, SELF-EMPLOYED, & OUTCAST",Hermit ,"lives in solitude, typically as a religious or spiritual discipline."
"XV. UNEMPLOYED, SELF-EMPLOYED, & OUTCAST",Housewife/Househusband ,cares for his or her family by managing household affairs and completing housework.
"XV. UNEMPLOYED, SELF-EMPLOYED, & OUTCAST",Pilgrim ,"journeys to some sacred place as an act of religious devotion, occasionally to settle there."
"XV. UNEMPLOYED, SELF-EMPLOYED, & OUTCAST",Prisoner ,held in confinement as a punishment for crimes they have been convicted of.
"XV. UNEMPLOYED, SELF-EMPLOYED, & OUTCAST",Rag-and-Bone Man ,collects unwanted household items and sells them to merchants.
"XV. UNEMPLOYED, SELF-EMPLOYED, & OUTCAST",Rebel/Political Dissident ,rises in opposition or armed resistance against an established government or ruler.
"XV. UNEMPLOYED, SELF-EMPLOYED, & OUTCAST",Refugee ,"leaves their home in order to escape war, persecution, or natural disaster."
"XV. UNEMPLOYED, SELF-EMPLOYED, & OUTCAST",Runaway Slave ,a slave who has left their master and traveled without authorization.
"XV. UNEMPLOYED, SELF-EMPLOYED, & OUTCAST",Scavenger/Mudlark/Tosher ,searches for and collects discarded items.
"XV. UNEMPLOYED, SELF-EMPLOYED, & OUTCAST",Slave ,a person who is the legal property of another and forced to obey them.
"XV. UNEMPLOYED, SELF-EMPLOYED, & OUTCAST",Squatter ,unlawfully occupies an uninhabited building or unused land.
"XV. UNEMPLOYED, SELF-EMPLOYED, & OUTCAST",Traveler/Wanderer/Vagabond ,wanders from place to place without a permanent home or job.
"XV. UNEMPLOYED, SELF-EMPLOYED, & OUTCAST",Urchin ,"a child who lives or spends most of their time in the streets, occasionally working as a thief or pickpocket."
